{
  "schema_version": "1.0", "fixture_only": true,
  "evidence_id": "evidence-demo", "org_id": "org-demo", "evidence_kind": "trusted_tool_result",
  "producer_identity": "verifier-demo", "spec_revision_id": "spec-invitation-v4-demo",
  "commit_set": [{"repository_id": "repository-demo", "commit_sha": "aaaaaaaaaaaaaaaaaaaaaaaaaaaaaaaaaaaaaaaa"}],
  "environment_digest": "bbbbbbbbbbbbbbbbbbbbbbbbbbbbbbbbbbbbbbbbbbbbbbbbbbbbbbbbbbbbbbbb",
  "test_plan_hash": "cccccccccccccccccccccccccccccccccccccccccccccccccccccccccccccccc",
  "result": "failed",
  "artifact_sha256": "dddddddddddddddddddddddddddddddddddddddddddddddddddddddddddddddd",
  "created_at": "2026-09-24T08:10:00Z", "stale_reason": null
}
